number,value,datetime_start,datetime_complete,duration,params_lr0,params_lrf,params_momentum,params_optimizer,params_patience,params_weight_decay,state
0,0.7744631669826305,2025-12-10 04:08:43.864618,2025-12-10 04:11:37.049023,0 days 00:02:53.184405,0.0001653632892843455,0.042410861387553775,0.9524417566785066,AdamW,20,0.00024177502732309586,COMPLETE
1,0.7687884810662099,2025-12-10 04:11:37.056428,2025-12-10 04:16:00.082501,0 days 00:04:23.026073,0.00014003444152875435,0.011977569087494491,0.9787366641380937,SGD,25,0.000854669531439934,COMPLETE
2,0.7898978750746269,2025-12-10 04:16:00.088223,2025-12-10 04:19:05.236034,0 days 00:03:05.147811,0.003236038896743346,0.09938936734931479,0.9032942182683085,AdamW,25,0.0008423223846120686,COMPLETE
3,0.7878013285579467,2025-12-10 04:19:05.241574,2025-12-10 04:20:33.167737,0 days 00:01:27.926163,0.0009465932271746646,0.09569358228910556,0.9219520369659433,AdamW,20,0.00031724325159776957,COMPLETE
4,0.7988298214605557,2025-12-10 04:20:33.173463,2025-12-10 04:25:23.817666,0 days 00:04:50.644203,0.005279585813297091,0.018163074045225852,0.9679919082869735,AdamW,25,0.00021969976691859307,COMPLETE
5,0.6477648589994811,2025-12-10 04:25:23.823333,2025-12-10 04:30:54.103426,0 days 00:05:30.280093,0.00014098889350162635,0.046646684976463154,0.9109015412018514,SGD,30,0.0005562404389026633,COMPLETE
6,0.7882047793696074,2025-12-10 04:30:54.108918,2025-12-10 04:36:18.454938,0 days 00:05:24.346020,0.0005697335633597408,0.04576602686358877,0.9169142685542172,SGD,20,0.0001838085285022788,COMPLETE
7,0.7816857637554308,2025-12-10 04:36:18.461502,2025-12-10 04:38:39.734290,0 days 00:02:21.272788,0.00021117127488082797,0.0232737615096679,0.926434780344604,AdamW,20,0.0009936258616384114,COMPLETE
8,0.6349597131468662,2025-12-10 04:38:39.739765,2025-12-10 04:44:09.689232,0 days 00:05:29.949467,0.00010752181058128077,0.028845559060390547,0.9294152704825762,SGD,45,0.0005198711989445897,COMPLETE
9,0.7896804547126641,2025-12-10 04:44:09.694772,2025-12-10 04:45:54.893925,0 days 00:01:45.199153,0.0005370594280870029,0.05573814759508547,0.9424707992087437,AdamW,20,0.00045234422083595204,COMPLETE
10,0.7979558206876473,2025-12-10 04:45:54.899471,2025-12-10 04:51:34.163798,0 days 00:05:39.264327,0.00943276825840778,0.001012117386496661,0.971694298336776,AdamW,40,4.936311502865015e-05,COMPLETE
11,0.7949128426823294,2025-12-10 04:51:34.169165,2025-12-10 04:56:59.179935,0 days 00:05:25.010770,0.009329544017970091,0.0018337496974260778,0.9736078867494584,AdamW,40,6.0122638138705524e-06,COMPLETE
12,0.8014451308882662,2025-12-10 04:56:59.185418,2025-12-10 05:01:18.105235,0 days 00:04:18.919817,0.007924561136731208,0.001104187806738481,0.9616466143995049,AdamW,35,4.7488150775017766e-05,COMPLETE
13,0.7971839070135615,2025-12-10 05:01:18.110692,2025-12-10 05:05:24.602022,0 days 00:04:06.491330,0.0033736827961107357,0.023510228387999262,0.9596652742197672,AdamW,35,0.0001662090028622558,COMPLETE
14,0.8047775909406396,2025-12-10 05:05:24.607504,2025-12-10 05:10:53.987664,0 days 00:05:29.380160,0.0029800015102175617,0.06365057071279445,0.9579750647686242,AdamW,50,0.00038752564033965115,COMPLETE
15,0.7977748976821755,2025-12-10 05:10:53.993102,2025-12-10 05:14:48.281713,0 days 00:03:54.288611,0.0019018133133133052,0.06599192228628184,0.9490346693589039,AdamW,50,0.00038288939416513383,COMPLETE
16,0.802795687559287,2025-12-10 05:14:48.287130,2025-12-10 05:18:41.165323,0 days 00:03:52.878193,0.0017610515547644965,0.0768435132071141,0.9604809449183684,AdamW,50,0.0006330290190536968,COMPLETE
17,0.7971647966532465,2025-12-10 05:18:41.170854,2025-12-10 05:22:02.870639,0 days 00:03:21.699785,0.0015936417497938575,0.07867609591805735,0.9353427023444488,AdamW,50,0.0006391460989205172,COMPLETE
18,0.7876278362011276,2025-12-10 05:22:02.876035,2025-12-10 05:25:53.052296,0 days 00:03:50.176261,0.0015206439397664542,0.07912018356892796,0.9553648118599259,SGD,45,0.0006910806253174457,COMPLETE
19,0.8029179355849023,2025-12-10 05:25:53.057676,2025-12-10 05:31:13.223210,0 days 00:05:20.165534,0.002930268447966243,0.06869418130943168,0.9474169757875672,AdamW,45,0.0006649020966199376,COMPLETE
20,0.7985233332006232,2025-12-10 05:31:13.229081,2025-12-10 05:36:17.590650,0 days 00:05:04.361569,0.0031555121713636725,0.061121325437472424,0.9437285013951973,AdamW,45,0.0007743416210099409,COMPLETE
21,0.7979231465823996,2025-12-10 05:36:17.596380,2025-12-10 05:41:04.898836,0 days 00:04:47.302456,0.0024219718092562586,0.0739465457916558,0.9638107061975417,AdamW,50,0.0006179277510168838,COMPLETE
22,0.8012639118067265,2025-12-10 05:41:04.904544,2025-12-10 05:45:57.327416,0 days 00:04:52.422872,0.004992155432073699,0.08551764375145868,0.9481035023614179,AdamW,50,0.00045831040522290354,COMPLETE
23,0.7909161200548211,2025-12-10 05:45:57.332946,2025-12-10 05:49:11.088866,0 days 00:03:13.755920,0.0008966334998992472,0.06829792698887911,0.9368003981921524,AdamW,45,0.0006828319391047524,COMPLETE
24,0.8034135523818497,2025-12-10 05:49:11.094465,2025-12-10 05:54:47.804236,0 days 00:05:36.709771,0.005574829275065883,0.090006346508337,0.9563498467770621,AdamW,40,0.00038406970679185525,COMPLETE
25,0.7949516724443282,2025-12-10 05:54:47.809735,2025-12-10 05:58:57.432501,0 days 00:04:09.622766,0.005401272995869334,0.08801643477232991,0.9557672608930643,AdamW,40,0.0003454666135247057,COMPLETE
26,0.7911574113759009,2025-12-10 05:58:57.438046,2025-12-10 06:02:32.797223,0 days 00:03:35.359177,0.004359527293474798,0.08902985131094601,0.945393375284158,SGD,40,0.00041953637382546665,COMPLETE
27,0.7943687631454617,2025-12-10 06:02:32.803055,2025-12-10 06:07:57.358094,0 days 00:05:24.555039,0.006289291736255155,0.056197508267382686,0.9668551550358865,AdamW,45,0.0003064669695847376,COMPLETE
28,0.8011548950758408,2025-12-10 06:07:57.363912,2025-12-10 06:12:49.655375,0 days 00:04:52.291463,0.002431683435645001,0.03677868599058682,0.9370262707968702,AdamW,40,0.000517467024699819,COMPLETE
29,0.7984362764661356,2025-12-10 06:12:49.660873,2025-12-10 06:18:24.127189,0 days 00:05:34.466316,0.0037722267496109853,0.06975859749517963,0.9564806622739296,AdamW,35,0.00028740409647053355,COMPLETE
30,0.7905318932379904,2025-12-10 06:18:24.132865,2025-12-10 06:23:08.696525,0 days 00:04:44.563660,0.0068697961254732005,0.06022340429514004,0.9502043455271126,AdamW,45,0.00013393508095436974,COMPLETE
31,0.8028754367778854,2025-12-10 06:23:08.702039,2025-12-10 06:26:31.238793,0 days 00:03:22.536754,0.0020796148804020655,0.07591145276243981,0.9609503572089887,AdamW,50,0.0007546101026671392,COMPLETE
32,0.7980042916577831,2025-12-10 06:26:31.244505,2025-12-10 06:29:35.435470,0 days 00:03:04.190965,0.002133718918356648,0.08470575660218266,0.9526826376809477,AdamW,50,0.0007862610836148127,COMPLETE
33,0.7983945005794592,2025-12-10 06:29:35.440947,2025-12-10 06:34:19.848835,0 days 00:04:44.407888,0.002858593705401499,0.09180314433334752,0.9771458649211849,AdamW,45,0.0009033573823256667,COMPLETE
34,0.79935918108313,2025-12-10 06:34:19.854201,2025-12-10 06:37:39.193005,0 days 00:03:19.338804,0.0012167356101096302,0.0729922642568356,0.9676363874949339,AdamW,50,0.0007328473435474875,COMPLETE
35,0.8040458697832125,2025-12-10 06:37:39.199425,2025-12-10 06:42:59.815122,0 days 00:05:20.615697,0.0011962290636414862,0.08160229307346509,0.9523379817164893,AdamW,45,0.000575816470832367,COMPLETE
36,0.7905296588411177,2025-12-10 06:42:59.820518,2025-12-10 06:46:35.593129,0 days 00:03:35.772611,0.0006879914127400362,0.08151448918864987,0.9525576591160764,SGD,40,0.0005689491763834476,COMPLETE
37,0.7867584004549474,2025-12-10 06:46:35.598655,2025-12-10 06:49:54.160581,0 days 00:03:18.561926,0.0003724389430739907,0.09661159235632703,0.940489410026969,AdamW,45,0.0003810332691803568,COMPLETE
38,0.7869124700322351,2025-12-10 06:49:54.166091,2025-12-10 06:53:21.481063,0 days 00:03:27.314972,0.001138293479316361,0.09265004421139418,0.9320050858274772,SGD,30,0.0005651442965098618,COMPLETE
39,0.802100826118893,2025-12-10 06:53:21.486676,2025-12-10 06:57:32.799742,0 days 00:04:11.313066,0.004111245170512063,0.0641069312755705,0.9463107649565848,AdamW,35,0.00023393361226952742,COMPLETE
40,0.7886524695327426,2025-12-10 06:57:32.805420,2025-12-10 07:00:54.729873,0 days 00:03:21.924453,0.00022247566133636257,0.04872414772946367,0.9650350800830124,AdamW,45,0.0004624464844875723,COMPLETE
41,0.7994034013257141,2025-12-10 07:00:54.735302,2025-12-10 07:05:35.006358,0 days 00:04:40.271056,0.0012652414474851096,0.09886827754047442,0.9583461557775533,AdamW,50,0.0008446765634467638,COMPLETE
42,0.8012380111514685,2025-12-10 07:05:35.011913,2025-12-10 07:10:50.699503,0 days 00:05:15.687590,0.002515027829214936,0.07315377488890493,0.9722509917800842,AdamW,45,0.0009116187526661143,COMPLETE
43,0.7982606965598433,2025-12-10 07:10:50.705101,2025-12-10 07:15:21.205970,0 days 00:04:30.500869,0.0008717809664404474,0.05244619532589243,0.903719813793028,AdamW,50,0.0007865736816048691,COMPLETE
44,0.7977917630664666,2025-12-10 07:15:21.211387,2025-12-10 07:19:11.693063,0 days 00:03:50.481676,0.0029420729765702227,0.08282941078136316,0.9521572331840831,AdamW,40,0.0005005534160323181,COMPLETE
45,0.7963221489456394,2025-12-10 07:19:11.698652,2025-12-10 07:24:01.912095,0 days 00:04:50.213443,0.0013932321776896673,0.0629677039260277,0.9618317206298624,AdamW,50,0.0005800759032532597,COMPLETE
46,0.7906932636303126,2025-12-10 07:24:01.917626,2025-12-10 07:27:33.952283,0 days 00:03:32.034657,0.0019633640794224547,0.07097348229165014,0.9546673257574164,SGD,45,0.0006883012452719798,COMPLETE
47,0.7994941426592599,2025-12-10 07:27:33.957732,2025-12-10 07:32:47.846983,0 days 00:05:13.889251,0.005431685712372791,0.037809268619926284,0.9418019925087544,AdamW,40,0.0003958182670583158,COMPLETE
48,0.8021305174087301,2025-12-10 07:32:47.852435,2025-12-10 07:37:39.650642,0 days 00:04:51.798207,0.004048421453986271,0.07864912208520654,0.9702862142103623,AdamW,50,0.0007434149100001284,COMPLETE
49,0.7939260119920247,2025-12-10 07:37:39.656149,2025-12-10 07:42:15.152909,0 days 00:04:35.496760,0.007346792629547226,0.05657287062999266,0.9220086150079226,AdamW,45,0.0002699393625942813,COMPLETE
